{
	"limits": [{
		"min": 0,
		"max": 180
	}, {
		"min": 0,
		"max": 180
	}, {
		"min": 0,
		"max": 180
	}, {
		"min": 0,
		"max": 180
	}],
	"home": [90, 90, 90, 90],
	"Autostart-Script": false,
	"Wifi-SSID": "",
	"Wifi-Password": "",
	"Hostname": "ESP-RobotProg",
	"ROS-Agent-IP": ""
}